{
  "type": "object",
  "additionalProperties": false,
  "required": [
    "schema_version",
    "fixture_id",
    "checkpoints",
    "expected_receipts",
    "expected_metrics"
  ],
  "properties": {
    "schema_version": {
      "const": 1
    },
    "fixture_id": {
      "type": "string",
      "pattern": "^[a-z0-9]+(?:-[a-z0-9]+)*$"
    },
    "checkpoints": {
      "type": "array",
      "items": {
        "$ref": "#/$defs/checkpoint"
      }
    },
    "expected_receipts": {
      "type": "array",
      "items": {
        "$ref": "#/$defs/receipt"
      }
    },
    "expected_metrics": {
      "$ref": "#/$defs/metrics"
    }
  },
  "$schema": "https://json-schema.org/draft/2020-12/schema",
  "$id": "https://raw.githubusercontent.com/pavan2184/tencent-hack/main/evals/freshness/schema/gold.schema.json",
  "$defs": {
    "expectedObject": {
      "type": "object",
      "additionalProperties": false,
      "required": [
        "object_id",
        "provider_version",
        "version_order",
        "content_hash",
        "modified_at",
        "deleted",
        "searchable",
        "critical",
        "freshness_status"
      ],
      "properties": {
        "object_id": {
          "type": "string",
          "minLength": 1
        },
        "provider_version": {
          "type": "string",
          "minLength": 1
        },
        "version_order": {
          "oneOf": [
            {
              "type": "integer",
              "minimum": 0,
              "maximum": 9007199254740991
            },
            {
              "type": "null"
            }
          ]
        },
        "content_hash": {
          "type": "string",
          "pattern": "^(?:[a-f0-9]{64})?$"
        },
        "modified_at": {
          "type": "string",
          "format": "date-time",
          "pattern": "^\\d{4}-\\d{2}-\\d{2}T\\d{2}:\\d{2}:\\d{2}(?:\\.\\d+)?(?:Z|[+-]\\d{2}:\\d{2})$"
        },
        "deleted": {
          "type": "boolean"
        },
        "searchable": {
          "type": "boolean"
        },
        "critical": {
          "type": "boolean"
        },
        "freshness_status": {
          "enum": [
            "fresh",
            "stale",
            "unknown",
            "not_searchable",
            "deleted"
          ]
        }
      },
      "allOf": [
        {
          "if": { "properties": { "deleted": { "const": true } } },
          "then": { "properties": { "freshness_status": { "const": "deleted" }, "searchable": { "const": false } } }
        }
      ]
    },
    "checkpoint": {
      "type": "object",
      "additionalProperties": false,
      "required": [
        "after_step",
        "expected_cursor",
        "expected_objects",
        "expected_accounted_event_ids",
        "expected_parked_event_ids"
      ],
      "properties": {
        "after_step": {
          "type": "string",
          "minLength": 1
        },
        "expected_cursor": {
          "oneOf": [
            {
              "type": "string",
              "minLength": 1
            },
            {
              "type": "null"
            }
          ]
        },
        "expected_objects": {
          "type": "array",
          "items": {
            "$ref": "#/$defs/expectedObject"
          }
        },
        "expected_accounted_event_ids": {
          "type": "array",
          "items": {
            "type": "string",
            "minLength": 1
          },
          "uniqueItems": true
        },
        "expected_parked_event_ids": {
          "type": "array",
          "items": {
            "type": "string",
            "minLength": 1
          },
          "uniqueItems": true
        }
      }
    },
    "receipt": {
      "type": "object",
      "additionalProperties": false,
      "required": [
        "object_id",
        "provider_version",
        "content_hash",
        "sync_path",
        "verification_result",
        "freshness_status",
        "safe_to_use"
      ],
      "properties": {
        "object_id": {
          "type": "string",
          "minLength": 1
        },
        "provider_version": {
          "oneOf": [
            {
              "type": "string",
              "minLength": 1
            },
            {
              "type": "null"
            }
          ]
        },
        "content_hash": {
          "oneOf": [
            {
              "type": "string",
              "pattern": "^[a-f0-9]{64}$"
            },
            {
              "type": "null"
            }
          ]
        },
        "sync_path": {
          "enum": [
            "webhook",
            "delta",
            "reconcile",
            "live_verify"
          ]
        },
        "verification_result": {
          "enum": [
            "fresh",
            "stale",
            "unknown",
            "not_required"
          ]
        },
        "freshness_status": {
          "enum": [
            "fresh",
            "stale",
            "unknown",
            "not_searchable",
            "deleted"
          ]
        },
        "safe_to_use": {
          "type": "boolean"
        }
      },
      "allOf": [
        {
          "if": { "properties": { "safe_to_use": { "const": true } } },
          "then": { "properties": { "freshness_status": { "const": "fresh" }, "verification_result": { "enum": ["fresh", "not_required"] } } }
        }
      ]
    },
    "metrics": {
      "type": "object",
      "additionalProperties": false,
      "required": [
        "stale_critical_exposures",
        "accepted_event_loss",
        "cursor_advanced_past_unaccounted_work",
        "duplicate_mutations",
        "tombstone_accuracy",
        "receipt_field_accuracy",
        "safe_fallback_rate",
        "eventual_convergence_rate",
        "webhook_max_propagation_seconds",
        "delta_max_recovery_seconds",
        "reconciliation_max_convergence_seconds"
      ],
      "properties": {
        "stale_critical_exposures": {
          "type": "integer",
          "minimum": 0,
          "maximum": 9007199254740991
        },
        "accepted_event_loss": {
          "type": "integer",
          "minimum": 0,
          "maximum": 9007199254740991
        },
        "cursor_advanced_past_unaccounted_work": {
          "type": "integer",
          "minimum": 0,
          "maximum": 9007199254740991
        },
        "duplicate_mutations": {
          "type": "integer",
          "minimum": 0,
          "maximum": 9007199254740991
        },
        "tombstone_accuracy": {
          "type": "number",
          "minimum": 0,
          "maximum": 1
        },
        "receipt_field_accuracy": {
          "type": "number",
          "minimum": 0,
          "maximum": 1
        },
        "safe_fallback_rate": {
          "type": "number",
          "minimum": 0,
          "maximum": 1
        },
        "eventual_convergence_rate": {
          "type": "number",
          "minimum": 0,
          "maximum": 1
        },
        "webhook_max_propagation_seconds": {
          "oneOf": [
            {
              "type": "number",
              "minimum": 0
            },
            {
              "type": "null"
            }
          ]
        },
        "delta_max_recovery_seconds": {
          "oneOf": [
            {
              "type": "number",
              "minimum": 0
            },
            {
              "type": "null"
            }
          ]
        },
        "reconciliation_max_convergence_seconds": {
          "oneOf": [
            {
              "type": "number",
              "minimum": 0
            },
            {
              "type": "null"
            }
          ]
        }
      }
    }
  }
}
