{
  "schema_version": 1,
  "fixture_id": "confluence-live-version-drift",
  "checkpoints": [
    {
      "after_step": "verify-version",
      "expected_cursor": null,
      "expected_objects": [
        {
          "object_id": "example-harbor-finance-policy",
          "provider_version": "v8",
          "version_order": 8,
          "content_hash": "265a77b02c437396073e9b1353a48c8c162deb35e9f9ba415dc6ae05f6616426",
          "modified_at": "2026-09-24T00:00:00.000Z",
          "deleted": false,
          "searchable": true,
          "critical": true,
          "freshness_status": "stale"
        }
      ],
      "expected_accounted_event_ids": [],
      "expected_parked_event_ids": []
    }
  ],
  "expected_receipts": [
    {
      "object_id": "example-harbor-finance-policy",
      "provider_version": "v7",
      "content_hash": "265a77b02c437396073e9b1353a48c8c162deb35e9f9ba415dc6ae05f6616426",
      "sync_path": "live_verify",
      "verification_result": "stale",
      "freshness_status": "stale",
      "safe_to_use": false
    }
  ],
  "expected_metrics": {
    "stale_critical_exposures": 0,
    "accepted_event_loss": 0,
    "cursor_advanced_past_unaccounted_work": 0,
    "duplicate_mutations": 0,
    "tombstone_accuracy": 1,
    "receipt_field_accuracy": 1,
    "safe_fallback_rate": 1,
    "eventual_convergence_rate": 1,
    "webhook_max_propagation_seconds": null,
    "delta_max_recovery_seconds": null,
    "reconciliation_max_convergence_seconds": null
  }
}
