{
  "schema_version": 1,
  "fixture_id": "google-drive-delete-reconcile",
  "checkpoints": [
    {
      "after_step": "reconcile-missing",
      "expected_cursor": null,
      "expected_objects": [
        {
          "object_id": "example-harbor-finance-drive-file",
          "provider_version": "v4",
          "version_order": 4,
          "content_hash": "",
          "modified_at": "2026-09-24T00:00:00.000Z",
          "deleted": true,
          "searchable": false,
          "critical": true,
          "freshness_status": "deleted"
        }
      ],
      "expected_accounted_event_ids": [],
      "expected_parked_event_ids": []
    }
  ],
  "expected_receipts": [
    {
      "object_id": "example-harbor-finance-drive-file",
      "provider_version": null,
      "content_hash": null,
      "sync_path": "reconcile",
      "verification_result": "not_required",
      "freshness_status": "deleted",
      "safe_to_use": false
    }
  ],
  "expected_metrics": {
    "stale_critical_exposures": 0,
    "accepted_event_loss": 0,
    "cursor_advanced_past_unaccounted_work": 0,
    "duplicate_mutations": 0,
    "tombstone_accuracy": 1,
    "receipt_field_accuracy": 1,
    "safe_fallback_rate": 1,
    "eventual_convergence_rate": 1,
    "webhook_max_propagation_seconds": null,
    "delta_max_recovery_seconds": null,
    "reconciliation_max_convergence_seconds": 3300
  }
}
