{
  "schema_version": 1,
  "fixture_id": "poison-event-durable-parking",
  "checkpoints": [
    {
      "after_step": "delta-page",
      "expected_cursor": "slack-c0",
      "expected_objects": [
        {
          "object_id": "example-harbor-finance-good-message",
          "provider_version": "v2",
          "version_order": 2,
          "content_hash": "8130d09571bca257684594b7d5ea0987242a6a3d3d2106db570288a339cef4ae",
          "modified_at": "2026-09-24T00:00:00.000Z",
          "deleted": false,
          "searchable": false,
          "critical": true,
          "freshness_status": "stale"
        },
        {
          "object_id": "example-harbor-finance-poison-message",
          "provider_version": "v2",
          "version_order": 2,
          "content_hash": "92890dd84de6ccf897f8c8b0eb6628f8a3197d9ebf42f0806c5df332f379f39e",
          "modified_at": "2026-09-24T00:00:01.000Z",
          "deleted": false,
          "searchable": false,
          "critical": true,
          "freshness_status": "unknown"
        }
      ],
      "expected_accounted_event_ids": [],
      "expected_parked_event_ids": []
    },
    {
      "after_step": "poison-parked",
      "expected_cursor": "slack-c1",
      "expected_objects": [
        {
          "object_id": "example-harbor-finance-good-message",
          "provider_version": "v2",
          "version_order": 2,
          "content_hash": "8130d09571bca257684594b7d5ea0987242a6a3d3d2106db570288a339cef4ae",
          "modified_at": "2026-09-24T00:00:00.000Z",
          "deleted": false,
          "searchable": true,
          "critical": true,
          "freshness_status": "fresh"
        },
        {
          "object_id": "example-harbor-finance-poison-message",
          "provider_version": "v2",
          "version_order": 2,
          "content_hash": "92890dd84de6ccf897f8c8b0eb6628f8a3197d9ebf42f0806c5df332f379f39e",
          "modified_at": "2026-09-24T00:00:01.000Z",
          "deleted": false,
          "searchable": false,
          "critical": true,
          "freshness_status": "unknown"
        }
      ],
      "expected_accounted_event_ids": [
        "ehf-good-v2"
      ],
      "expected_parked_event_ids": [
        "ehf-poison-v2"
      ]
    }
  ],
  "expected_receipts": [
    {
      "object_id": "example-harbor-finance-good-message",
      "provider_version": "v2",
      "content_hash": "8130d09571bca257684594b7d5ea0987242a6a3d3d2106db570288a339cef4ae",
      "sync_path": "delta",
      "verification_result": "not_required",
      "freshness_status": "fresh",
      "safe_to_use": true
    },
    {
      "object_id": "example-harbor-finance-poison-message",
      "provider_version": "v2",
      "content_hash": "92890dd84de6ccf897f8c8b0eb6628f8a3197d9ebf42f0806c5df332f379f39e",
      "sync_path": "delta",
      "verification_result": "unknown",
      "freshness_status": "unknown",
      "safe_to_use": false
    }
  ],
  "expected_metrics": {
    "stale_critical_exposures": 0,
    "accepted_event_loss": 0,
    "cursor_advanced_past_unaccounted_work": 0,
    "duplicate_mutations": 0,
    "tombstone_accuracy": 1,
    "receipt_field_accuracy": 1,
    "safe_fallback_rate": 1,
    "eventual_convergence_rate": 1,
    "webhook_max_propagation_seconds": null,
    "delta_max_recovery_seconds": 10,
    "reconciliation_max_convergence_seconds": null
  }
}
