{
  "schema_version": 1,
  "fixture_id": "confluence-critical-runbook-webhook",
  "checkpoints": [
    {
      "after_step": "webhook-accepted",
      "expected_cursor": null,
      "expected_objects": [
        {
          "object_id": "example-harbor-finance-runbook",
          "provider_version": "v2",
          "version_order": 2,
          "content_hash": "4795019065e551913282e061e3613f6bb84abb24bbce9546598f2146250d5c89",
          "modified_at": "2026-09-24T00:00:00.000Z",
          "deleted": false,
          "searchable": false,
          "critical": true,
          "freshness_status": "stale"
        }
      ],
      "expected_accounted_event_ids": [],
      "expected_parked_event_ids": []
    },
    {
      "after_step": "indexed-and-embedded",
      "expected_cursor": null,
      "expected_objects": [
        {
          "object_id": "example-harbor-finance-runbook",
          "provider_version": "v2",
          "version_order": 2,
          "content_hash": "4795019065e551913282e061e3613f6bb84abb24bbce9546598f2146250d5c89",
          "modified_at": "2026-09-24T00:00:00.000Z",
          "deleted": false,
          "searchable": true,
          "critical": true,
          "freshness_status": "fresh"
        }
      ],
      "expected_accounted_event_ids": [
        "ehf-runbook-v2"
      ],
      "expected_parked_event_ids": []
    }
  ],
  "expected_receipts": [
    {
      "object_id": "example-harbor-finance-runbook",
      "provider_version": "v2",
      "content_hash": "4795019065e551913282e061e3613f6bb84abb24bbce9546598f2146250d5c89",
      "sync_path": "webhook",
      "verification_result": "not_required",
      "freshness_status": "fresh",
      "safe_to_use": true
    }
  ],
  "expected_metrics": {
    "stale_critical_exposures": 0,
    "accepted_event_loss": 0,
    "cursor_advanced_past_unaccounted_work": 0,
    "duplicate_mutations": 0,
    "tombstone_accuracy": 1,
    "receipt_field_accuracy": 1,
    "safe_fallback_rate": 1,
    "eventual_convergence_rate": 1,
    "webhook_max_propagation_seconds": 44,
    "delta_max_recovery_seconds": null,
    "reconciliation_max_convergence_seconds": null
  }
}
